Numero catalogo,Nome,Tipo di oggetto,Costellazione,Coordinate (2000),Distanza,Magnitudine visuale,Dimensioni apparenti,Dimensioni reali,Descrizione
M1,Nebulosa Granchio (Crab Nebula) NGC 1952,Resto di supernova,Toro,"A.R. 05h 34,5min; Dec. +22° 01'",6300 a.l.,"8,4",6' × 4',"11 × 7,5 a.l.","La Nebulosa Granchio (nota anche come Nebulosa del Granchio o con le sigle di catalogo M 1 e NGC 1952) è un resto di supernova visibile nella costellazione del Toro. Scoperta nel 1731 da John Bevis, la nebulosa è il primo oggetto del catalogo di oggetti astronomici pubblicato da Charles Messier nel 1774.La nebulosa, oggi vasta più di sei anni luce, è formata dai gas in espansione espulsi durante l'esplosione della Supernova 1054; i gas si stanno espandendo alla velocità di 1 500 km/s e possiedono una massa totale di circa (4,6 ± 1,8) M⊙. La supernova che la produsse fu osservata per la prima volta il 4 luglio 1054 e venne registrata dagli astronomi cinesi e arabi dell'epoca; la sua luminosità era tale che la magnitudine apparente dell'evento fu compresa tra −7 e −4,5, tale da renderla visibile ad occhio nudo durante il giorno, sorpassando la luminosità apparente di Venere. Al centro della nebulosa si trova la pulsar del Granchio (nota anche come PSR B0531+21), una stella di neutroni con un diametro di circa 10 chilometri, scoperta nel 1968: fu la prima osservazione di un'associazione tra pulsar e resti di supernova, una scoperta fondamentale per l'interpretazione delle pulsar come stelle di neutroni.La Nebulosa Granchio è spesso usata come calibrazione nell'astronomia a raggi X: è molto luminosa in questa banda, e il suo flusso è stabile, eccetto la pulsar vera e propria: quest'ultima infatti fornisce un forte segnale periodico che può essere usato per controllare le temporizzazioni dei sensori a raggi X. Nell'astronomia a raggi X, ""Crab"" (parola inglese che significa ""Granchio"") e ""milliCrab"" sono a volte usate come unità di flusso. Pochissime sorgenti a raggi X hanno una luminosità superiore ad 1 Crab."
M2,NGC 7089,Ammasso globulare,Acquario,"A.R. 21h 33,5min; Dec. −0° 49'",37.000 a.l.,"6,5","12,9'",140 a.l.,"M 2 (noto anche come NGC 7089) è un ammasso globulare visibile nella costellazione dell'Aquario. Individuato per la prima volta da Giovanni Domenico Maraldi l'11 settembre 1746, mentre stava osservando la cometa di De Chéseaux, fu riscoperto più tardi in modo indipendente da Charles Messier, esattamente 14 anni dopo, l'11 settembre 1760. È situato a 5 gradi a nord di β Aquarii, alla stessa declinazione di α Aquarii. Data la sua magnitudine apparente, M2 è un oggetto difficile da osservare a occhio nudo, visibile solo in un cielo in condizioni ottimali, ma è un obiettivo semplice anche per ausili ottici minimi come binocoli da teatro, che mostrano una piccola stella avvolta da luce nebbiosa, in un campo privo di altre compagne."
M3,NGC 5272,Ammasso globulare,Cani da caccia,"A.R. 13h 42,2min; Dec. +28° 23'",33.000 a.l.,"6,2","16,2'",150 a.l.,"M 3 (conosciuto anche come NGC 5272) è un ammasso globulare visibile nella costellazione dei Cani da Caccia; è fra i più brillanti del cielo. Questo ammasso è uno dei più grandi e luminosi, ed è formato da circa 500.000 stelle. È situato a una distanza di circa 33.900 anni luce dalla Terra. M3 ha una magnitudine apparente di 6,2 che lo rende visibile a occhio nudo in determinate condizioni. Visto da un telescopio di dimensioni media, l'ammasso è completamente definito. Con M13 ed M5, M3 è uno dei tre ammassi globulari più brillanti dell'emisfero boreale. Ciò ha fatto sì che esso sia stato studiato più dia altri ammassi del suo tipo, e il diagramma H-R che risulta da questi studi dimostra che M3 è un ammasso formato da stelle estremamente vecchie. Si ritiene che abbiano un'età di circa 10 o più miliardi di anni, anche se le stime degli studiosi variano di molto. Una caratteristica veramente insolita di M3 è il fatto che contenga una giovanissima stella azzurra di tipo spettrale O8 (la prima delle cosiddette Blue Stragglers)."
M4,NGC 6121,Ammasso globulare,Scorpione,"A.R. 16h 23,6min; Dec. −26° 32'",5700 a.l.,"5,9",26',50 a.l.,"M 4 (noto anche come NGC 6121) è un brillante ammasso globulare visibile nella costellazione dello Scorpione; è visibile anche con piccoli strumenti. M4 è uno degli ammassi più facili da localizzare: basta infatti puntare su Antares e spostarsi di appena 1.3° ad ovest; in condizioni atmosferiche ottimali è perfino visibile ad occhio nudo, sebbene con estrema difficoltà, mentre già con un buon binocolo è facilmente osservabile. M4 è uno degli ammassi globulari più grandi e vicini a noi; secondo le misurazioni tradizionali, disterebbe solo 6.000 anni luce dalla Terra, con un'estensione apparente di 22,8 minuti d'arco. Ciò significherebbe che M4 ha un'estensione reale di circa 95 anni luce. Sono stati determinati la magnitudine e il colore di circa 660 stelle, tra le quali le più brillanti sono di magnitudine 15,6. In M4 sono note almeno 43 variabili tra cui 3 a breve periodo del tipo RR Lyrae e due semi-regolari rosse con periodo rispettivamente di 60 e 40 giorni. Nel 1987 è stata scoperta in M4 la prima pulsar con un periodo di circa tre millisecondi. M4 contiene più di 100.000 stelle, circa la metà delle quali è concentrata in 8 anni luce dal centro. Il 10 luglio 2003 il telescopio Hubble ha scoperto un pianeta orbitante attorno a un sistema binario, formato da una pulsar, PSR B1620-26, e da una nana bianca. Questo pianeta extrasolare, PSR B1620-26c, viene chiamato anche Matusalemme, a causa della sua età stimata: avrebbe, infatti, circa 13 miliardi di anni."
M5,NGC 5904,Ammasso globulare,Serpente,"A.R. 15h 18,6min; Dec. +02° 05'",24.000 a.l.,"5,8",17,120 a.l.,"M 5 (conosciuto anche come NGC 5904) è un ammasso globulare visibile nella costellazione del Serpente (Testa); è piuttosto brillante. M5 è situato ad una distanza di circa 24.500 anni luce dalla Terra e contiene più di 100.000 stelle (secondo alcune stime 500.000); si sa che almeno un centinaio di queste sono stelle variabili del tipo RR Lyrae, con periodi che si aggirano intorno ai 0.5 giorni. La sua magnitudine apparente è 5,6. Questo ammasso mostra una notevole ellitticità e con un'età stimata in 13 miliardi di anni si pensa sia uno degli ammassi globulari più vecchi. Ci appare di circa 17 primi d'arco e con un diametro reale di circa 130 anni luce è anche considerato uno dei più grandi ammassi globulari. M5 si sta allontanando da noi a circa 50 km/s"
M6,Ammasso Farfalla NGC 6405,Ammasso aperto,Scorpione,"A.R. 17h 40,1min; Dec. −32° 13'",1500-2000 a.l.,"4,2",54',20 a.l.,"L'Ammasso Farfalla (noto anche come M 6 o NGC 6405) è un brillante ammasso aperto visibile con facilità nella costellazionedello Scorpione. L'ammasso si estende per circa 20 anni luce e dista, secondo stime diverse, da 1500 a 2000 anni luce dalla Terra; l'incertezza è data soprattutto perché l'ammasso si trova in una regione oscurata dalla polvere interstellare. Come gli altri ammassi aperti è formato prevalentemente da stelle giovani blu sebbene la stella più luminosa sia arancione.L'età stimata di M6 è di circa 50 milioni di anni, il che lo rende simile a quella di diversi ammassi aperti situati lungo l'anello Lindblad, come l'Ammasso di Alfa Persei. Sono note circa 120 stelle che potrebbero essere membri fisici di M6; tuttavia, dato l'elevato numero di stelle che si sovrappongono sulla linea di vista, le componenti apparenti appaiono molte di più."
M7,"Coda dello Scorpione, Ammasso di Tolomeo NGC 6475",Ammasso aperto,Scorpione,"A.R. 17h 53,9min; Dec. −34° 49’",800 a.l.,"3,3",1° 20',19 a.l.,"M 7 (noto talvolta anche col nome Ammasso di Tolomeo o con la sigla NGC 6475) è un brillante ammasso aperto visibile nella costellazione dello Scorpione; era conosciuto anche in epoca antica ed è uno degli ammassi aperti più grandi e luminosi del cielo. M7 era già conosciuto da Tolomeo nel 130, che lo descrisse nel suo catalogo di oggetti del cielo come un ammasso nebuloso successivo alla coda dello Scorpione.M7 è formato da alcune centinaia di stelle, principalmente stelle blu; circa un'ottantina di queste sono più brillanti della decima magnitudine. Il diametro apparente dell'ammasso è di circa 1°,3, che alla distanza di 1000 anni luce equivale ad una dimensione reale di 25 anni luce; secondo studi condotti alla fine degli anni duemila, l'età dell'ammasso è di 200 milioni di anni, mentre il parametri di metallicità sono simili a quelli del Sole. La stella più brillante di M7 è una gigante gialla di magnitudine 5,6, dunque visibile già ad occhio nudo sotto buoni cieli, e di classe spettrale G8; a questa si aggiungono tre giganti rosse e alcune decine di stella di classe B e A. Alcune componenti di massa intermedia dell'ammasso presentano delle forti anomalie nella composizione della loro fotosfera; queste stelle possiedono una sovrabbondanza di alcuni elementi come il cromo e il manganese e una relativa scarsità di ossigeno e magnesio, nel caso delle stelle di classe A. Come ciò possa influire sull'evoluzione di queste stelle non è ancora ben chiaro."
M8,Nebulosa Laguna NGC 6523,Nebulosa ad emissione associata ad ammasso aperto,Sagittario,"A.R. 18h 03,8min; Dec. −24° 23'",5200 a.l.,"4,6",1° 30' × 40',140 × 60 a.l.,"La Nebulosa Laguna (anche nota come M 8, o NGC 6523) è una nebulosa diffusa visibile nella costellazione del Sagittario; fu scoperta da Le Gentil nel 1747. Si tratta di una delle regioni H II più brillanti della volta celeste ed è visibile anche ad occhio nudo sotto cieli abbastanza limpidi e bui.La Nebulosa Laguna appartiene al braccio di spirale galattico immediatamente più interno rispetto al nostro, il Braccio del Sagittario; dista circa 4100 anni luce dalla Terra ed è sede di alcuni oggetti e fenomeni astronomici interessanti, come ammassi aperti (vedi NGC 6530), regioni di formazione stellare, nebulose oscure, giovani stelle, gas caldi. Il nome ""laguna"" deriva dalla nube di polvere visibile ad est dell'ammasso aperto centrale. "
M9,NGC 6333,Ammasso globulare,Ofiuco,"A.R. 17h 19,2min; Dec. −18° 31'",26.000 a.l.,"7,9",9',70 a.l.,"M 9 (conosciuto anche come NGC 6333) è un ammasso globulare visibile nella costellazione dell'Ofiuco. M9 è uno degli ammassi globulari più vicini al nucleo della Via Lattea, con una distanza stimata di 5.500 anni luce dal centro galattico; il suo diametro angolare di 12 minuti d'arco e corrisponde a un'estensione di circa 90 anni luce, a una distanza di circa 25.800 anni luce dalla Terra. La sua magnitudine apparente è 7,7, la magnitudine assoluta -8.04; la luminosità totale dell'ammasso è circa 120.000 volte quella del Sole. Si allontana da noi alla velocità di 224 km/s. In M9 sono state scoperte 19 stelle variabili. Nelle vicinanze, a nord-est, c'è il debole ammasso globulare NGC 6356, mentre, più o meno alla stessa distanza a sud-est, c'è l'ammasso globulare NGC 6342."
M10,NGC 6254,Ammasso globulare,Ofiuco,"A.R. 16h 57,1min; Dec. −04° 06'",14.000 a.l.,"6,6",15',70 a.l.,"M 10 (conosciuto anche come NGC 6254) è un ammasso globulare situato nella costellazione dell'Ofiuco. L'ammasso è uno dei più vicini a noi dal momento che si trova a soli 14.000 anni luce. Nonostante un diametro modesto di soli 60 anni luce, il suo diametro apparente è invece abbastanza grande ed equivale alla metà del diametro della Luna piena. L'ammasso ha poche stelle variabili, ne contiene solo 3. Le stelle più brillanti dell'ammasso hanno una magnitudine apparente di 13. La sua velocità di recessione rispetto a noi è di 69 km/s."
M11,Ammasso dell’Anatra Selvatica NGC 6705,Ammasso aperto,Scudo,"A.R. 18h 51,1min; Dec. −06° 16'",5600 a.l.,"5,8",14',23 a.l.,"M 11 (noto talvolta anche come Ammasso dell'Anitra selvatica o con la sigla NGC 6705) è un ammasso aperto visibile nella costellazione dello Scudo. M11 è uno dei più ricchi e densi ammassi aperti conosciuti: contiene infatti circa 2900 componenti accertate; fra queste circa 400 sono più luminose della magnitudine 14. Dista 6000 anni luce dalla Terra e ha un'età stimata di 250 milioni di anni.
La densità di stelle nell'ammasso è stata stimata in circa 83 stelle per parsec cubico nelle vicinanze del centro, e in circa 10 stelle per parsec cubico intorno alla metà del suo raggio. La stella più luminosa dell'ammasso ha una magnitudine apparente di 8,5."
M12,NGC 6218,Ammasso globulare,Ofiuco,"A.R. 16h 47,2min; Dec. −01° 57'",16.000 a.l,"6,6",14',75 a.l.,"M 12 (conosciuto anche come NGC 6218) è un ammasso globulare visibile nella costellazione dell'Ofiuco. L'ammasso dista da noi 16.000 anni luce e ha un diametro apparente di 16,0', che corrisponde a un diametro reale di 75 anni luce. È uno degli ammassi con la minore densità di stelle, tanto che un tempo si pensava fosse un ammasso aperto molto riunito. Le stelle più brillanti dell'ammasso hanno una magnitudine di +12. Nell'ammasso sono state scoperte 13 stelle variabili. M12 si dirige verso di noi alla velocità di 16 km/s."
M13,Grande ammasso globulare in Ercole NGC 6205,Ammasso globulare,Ercole,"A.R. 16h 41,7min; Dec. +36° 28'",25.000 a.l.,"5,9",17',170 a.l.,"L'Ammasso Globulare di Ercole (conosciuto anche come M 13 dalla sua posizione nel Catalogo di Messier, oppure come NGC 6205) è un ammasso globulare visibile nella costellazione di Ercole. Si tratta dell'ammasso globulare più luminoso dell'emisfero boreale ed è visibile anche ad occhio nudo. M13 ha una magnitudine apparente di 5,8. Il suo diametro angolare è di 23', mentre il suo diametro reale è di circa 165 anni luce. M13 contiene diverse centinaia di migliaia di stelle, la più brillante delle quali è di magnitudine 11.95. Attorno al suo nucleo, le stelle sono circa 500 volte più concentrate che nei dintorni del sistema solare. L'età di M 13 è stata stimata tra i 12 e i 14 miliardi di anni. La sua distanza dalla Terra è di 23.157 anni luce. Apparendo così luminoso ad una così grande distanza, la sua luminosità reale è elevatissima, oltre 300.000 volte quella del Sole. Nel 1974 fu fatto un tentativo simbolico di inviare un messaggio verso altri mondi. Per celebrare un consistente ampliamento del radiotelescopio da 305 metri di Arecibo, un messaggio in codice di 1.679 bit fu trasmesso verso M13."
M14,NGC 6402,Ammasso globulare,Ofiuco,"A.R. 17h 37,6min; Dec. −03° 15'",30.000 a.l.,"7,6",12',110 a.l.,"M 14 (noto anche come NGC 6402) è un ammasso globulare visibile nella costellazione dell'Ofiuco. L'ammasso, di forma ellittica, dista da noi 30.000 anni luce; con la sua magnitudine assoluta di -9,1 l'ammasso è molto più brillante intrinsecamente rispetto agli altri ammassi della costellazione, M10 e M12. La sua luminosità è equivalente a quella di 400.000 soli e contiene centinaia di migliaia di stelle, anche se la concentrazione di stelle al centro dell'ammasso è relativamente bassa. M14 contiene inoltre più di 70 stelle variabili; fra cui una nova apparsa nel 1938. Le stelle più brillanti dell'ammasso hanno una magnitudine di 14. "
M15,NGC 7078,Ammasso globulare,Pegaso,A.R. 21h 30min; Dec. +12° 10',33.500 a.l.,"6,4",12',110 a.l.,"M 15 (noto anche come, NGC 7078) è un ammasso globulare situato nella costellazione di Pegaso, al limite della visibilità all'occhio nudo; è uno degli ammassi più densi della Via Lattea. L'ammasso è uno dei più densi conosciuti: il suo nucleo ha subito una contrazione in passato, forse a causa di un buco nero; questo collasso del nucleo è stato osservato anche in altri ammassi, come M30. L'ammasso contiene molte stelle variabili, ben 110, che hanno permesso di stimare una distanza pari a 33.600 anni luce. Molte di queste sono del tipo RR Lyrae, ma è nota anche una variabile Cefeide. L'ammasso accoglie anche un notevole numero di pulsar e di stelle di neutroni, resti di stelle massive ""morte"" durante la giovinezza dell'ammasso; inoltre, è uno dei pochi ammassi a contenere una nebulosa planetaria, Pease 1, nella sua periferia."
M16,Nebulosa Aquila o Nebulosa Regina delle stelle NGC 6611 + IC 4703 ,Ammasso aperto associato a nebulosa ad emissione,Serpente,"A.R. 18h 18,8min; Dec. −13° 47'",8200 a.l.,6,6',17 a.l.,"La Nebulosa Aquila (nota anche come M 16 o NGC 6611) è una grande regione H II visibile nella costellazione della Coda del Serpente; è formata da un giovane ammasso aperto di stelle associato ad una nebulosa a emissione composta da idrogeno ionizzato, catalogata come IC 4703. La sua distanza è sempre stata relativamente incerta, ma si tende ad accettare un valore di circa 5700 anni luce dalla Terra, ponendola così nella zona media del Braccio del Sagittario; contiene alcune formazioni estremamente conosciute, come i Pilastri della Creazione, le lunghe colonne di gas oscuro originate dall'azione del vento stellare delle componenti dell'ammasso centrale e che sono responsabili anche del nome proprio della nebulosa stessa, a causa della loro forma. In esse sono presenti alcuni oggetti stellari giovani, che testimoniano che i processi di formazione stellare sono tuttora in atto, anche se non è chiaro se questi siano favoriti od osteggiati dall'azione del vento stellare delle stelle vicine, né è chiaro se il vento effettivamente influisca in qualche maniera su questi fenomeni. L'ammasso è composto da un gran numero di supergiganti blu molto calde e brillanti; la loro età tipica è di appena 2-3 milioni di anni, cioè meno di un millesimo dell'età del nostro Sole; la stella più brillante dell'ammasso è di magnitudine 8,24, ben visibile anche con un binocolo. La nebulosa è nota fin dal Settecento ed è uno degli oggetti più noti fra quelli del Catalogo di Messier; si rivela con facilità nelle fotografie ed è dunque un buon soggetto per gli appassionati dell'astrofotografia amatoriale. https://it.wikipedia.org/wiki/Nebulosa_Aquila"
M17,"Nebulosa Omega, Nebulosa Cigno, Nebulosa Ferro di Cavallo, Nebulosa Aragosta
NGC 6618",Nebulosa ad emissione associata ad ammasso aperto,Sagittario,"A.R. 18h 20,8min; Dec. −16° 11'",5000 a.l.,6,46' x 37',65 x 55 a.l.,"La Nebulosa Omega (nota anche come Nebulosa Cigno, Nebulosa Ferro di Cavallo, Nebulosa Aragosta o con le sigle di catalogo M 17 e NGC 6618) è una nebulosa a emissione, scoperta da de Chéseaux nel 1746 e riscoperta da Charles Messier nel 1764, situata nella costellazione del Sagittario.La Nebulosa Omega, trovandosi a una distanza di circa 6000 anni luce da noi, viene a trovarsi su un braccio di spirale galattico più interno al nostro Braccio di Orione, il Braccio del Sagittario, su cui giacciono anche altri oggetti molto brillanti come molti degli ammassi aperti visibili fra le costellazioni dello Scorpione e del Centauro, fino alla Nebulosa della Carena. Uno studio del 2008 afferma comunque che questo braccio sarebbe solo una grande condensazione di gas e polveri da cui sono nate diverse stelle giovani. La linea di vista dalla Terra alla nebulosa è sì disturbata dalla presenza di polveri interstellari, anche a causa della lunga distanza, ma appare comunque meno oscurata rispetto ad altre zone adiacenti: infatti la nebulosa è visibile sul bordo della cosiddetta Fenditura dell'Aquila, una lunga scia di nebulose oscure appartenenti al nostro braccio di spirale che schermano completamente la luce proveniente dalle stelle della fascia settentrionale del Braccio del Sagittario."
M18,NGC 6613,Ammasso aperto,Sagittario,"A.R. 18h 19,9min; Dec. −17° 08'",4900 a.l.,"6,9",9',17 a.l.,"M 18 (noto anche come NGC 6613) è un ammasso aperto non molto appariscente visibile nella costellazione del Sagittario. M18 contiene principalmente stelle di tipo spettrale B3, ciò significa che l'ammasso è relativamente giovane, la sua età stimata è di 32 milioni di anni; le stelle più brillanti hanno una magnitudine apparente pari a circa 9.L'ammasso è localizzato a circa 4.900 anni luce dal sistema solare, tenendo conto del suo diametro apparente di 9 minuti di arco, il suo diametro reale risulta essere circa 17 anni luce."
M19,NGC 6273,Ammasso globulare,Ofiuco,"A.R. 17h 02,6min; Dec. −26° 16'",28.000 a.l.,"7,1",13',130 a.l.,"M 19 (noto anche come NGC 6273) è un ammasso globulare visibile nella parte meridionale nella costellazione dell'Ofiuco. M19 è situato alla distanza di circa 28.000 anni luce dal sistema solare ed è caratterizzato dalla sua forma particolarmente ellittica, uno degli ammassi globulari più ovaleggianti che si conoscano: la sua ellitticità sarebbe E4; si tratta anche uno degli ammassi globulari più vicini al nucleo galattico, da cui disterebbe solo 5.200 anni luce. Le sue stelle più brillanti sono di quattordicesima magnitudine; il diametro maggiore sarebbe di circa 140 anni luce."
M20,Nebulosa Trifida NGC 6514,Nebulosa ad emissione associata ad ammasso aperto,Sagittario,"A.R. 18h 02,6min; Dec. −23° 02",5200 a.l.,"6,3",29',45 a.l.,"La Nebulosa Trifida (nota anche come M 20, o NGC 6514) è una nebulosa a emissione e una regione H II situata nella costellazione del Sagittario. Deve il suo nome alle tre linee scure di nubi di polvere che la dividono in tre parti.La Neblosa Trifida dista circa 5.000 anni luce dalla Terra, venendosi così a trovare nel Braccio del Sagittario, ossia il braccio di spirale immediatamente più interno del nostro. La singola stella massiva visibile al centro è fonte della gran parte dell'illuminazione dell'intera nebulosa; ha un'età stimata di circa 300.000 anni, che ne farebbe la più giovane regione di formazione stellare conosciuta.Le stelle che eccitano i suoi gas sono giganti blu di classe spettrale O e di magnitudine assoluta pari a -5, dell'età di circa 7 milioni di anni; i vari colori sono dati dai diversi elementi: il rosso è tipico dell'idrogeno, mentre l'azzurro dell'ossigeno. Le bande oscure sono invece polveri e gas freddi e non illuminati."
M21,NGC 6531,Ammasso aperto,Sagittario,"A.R. 18h 04,6min; Dec. −22° 30'",4000 a.l.,"5,9",13',16 a.l.,"M 21 (noto anche come NGC 6531) è un ammasso aperto situato nella costellazione del Sagittario e scoperto il 5 giugno 1764 da Charles Messier.L'ammasso aperto ha una concentrazione centrale di stelle notevole per questo tipo di oggetto, essendo la distanza fra le stelle vicina all'anno luce. Una sessantina di stelle appartengono all'ammasso; le stelle più brillanti (magnitudine 8) sono di tipo BO e quindi molto giovani: l'età dell'ammasso è stimata in meno di 5 milioni di anni. La distanza dell'ammasso varia molto a seconda delle stime, ma si attesta sui 4.000 anni luce."
M22,NGC 6656,Ammasso globulare,Sagittario,"A.R. 18h 36,4min; Dec. −23° 54'",10.400 a.l.,"5,1",24',97 a.l.,"M 22 (noto anche come NGC 6656) è un ammasso globulare situato nella costellazione del Sagittario; si tratta del quinto in ordine di luminosità di tutta la volta celeste ed è individuabile pure ad occhio nudo. Questo ammasso globulare è uno dei più vicini alla Terra: si trova a soli 10.400 anni luce e per questo arriva a coprire una regione di area pari a quella della Luna; a questa distanza il suo diametro reale corrisponde a circa 97 anni luce. Contiene circa 100.000 stelle, ma solo una trentina di stelle variabili, la metà delle quali già note all'inizio del Novecento; gran parte di queste sono del tipo RR Lyrae, di cui una con un periodo di 199,5 giorni, sebbene non sia più considerata un membro reale dell'ammasso. La magnitudine media delle 25 stelle più luminose di M22 è pari a 12,9, dunque maggiormente luminoso delle componenti di M13, dove questo valore è di 13,7. M22 si allontana da noi alla velocità di 144 km/s. M22 è anche uno dei rari ammassi globulari, assieme a M15, a ospitare una nebulosa planetaria, che porta il nome di IRAS 18333-2357 ed è stata scoperta dal satellite IRAS.Diversamente da M15, l'ammasso non possiede una concentrazione centrale di stelle marcata. La nebulosa planetaria, riconosciuta come tale solo nel 1989, possiede una stella blu centrale; l'età della nebulosa (chiamata anche GJJC1) è di circa 6000 anni."
M23,NGC 6494,Ammasso aperto,Sagittario,"A.R. 17h 56,8min ; Dec. −19° 01'",2150 a.l.,"5,5",27',17 a.l.,"M 23 (conosciuto anche come NGC 6494) è un ammasso aperto visibile nella costellazione del Sagittario. M23 si trova alla distanza di circa 2.150 anni luce dalla Terra; il suo diametro si aggira intorno ai 15-20 anni luce.All'interno dell'ammasso sono stati identificati circa 150 membri; le sue stelle più calde sono di tipo B9 e le più luminose raggiungono la magnitudine 9,2. L'età stimata si aggira fra i 220 e i 300 milioni di anni."
