Numero catalogo,Nome,Tipo di oggetto,Costellazione,Coordinate (2000),Distanza,Magnitudine visuale,Dimensioni apparenti,Dimensioni reali,Descrizione
M45,Pleiadi o Le Sette Sorelle,Ammasso aperto con nebulosa a riflessione,Toro,"A.R. 03h 47,0min; Dec. +24° 07'",440 a.l.,"1,6",110',13 a.l.,"Le Pleiadi (conosciute anche come le Sette sorelle, la Chioccetta o con la sigla M45 del catalogo di Charles Messier) sono un ammasso aperto visibile nella costellazione del Toro. Questo ammasso, piuttosto vicino (440 anni luce), conta diverse stelle visibili ad occhio nudo; anche se dagli ambienti cittadini solo cinque o sei delle stelle più brillanti sono visibili, da un luogo più buio se ne possono contare fino a dodici. Tutte le sue componenti sono circondate da leggere nebulose a riflessione, osservabili specialmente in fotografie a lunga esposizione prese con telescopi di dimensione ragguardevole.I membri visibili delle Pleiadi sono stelle blu o bianche, molto luminose; l'ammasso conta in realtà centinaia di altre stelle, la gran parte delle quali sono troppo deboli per essere visibili ad occhio nudo. Le Pleiadi sono un ammasso giovane, con un'età stimata di circa 100 milioni di anni, e una vita prevista di soli altri 250 milioni di anni, a causa della sua bassa densità. A causa della loro brillantezza e vicinanza fra loro, le stelle delle Pleiadi sono note dall'antichità: Omero le citava, come pure Tolomeo ed altri autori dell'età classica. Da quando fu noto che le stelle erano corpi celesti simili al Sole, si iniziò ad ipotizzare che fossero in qualche modo legate fra loro; con lo studio del moto proprio degli astri e la determinazione delle distanze, fu chiaro che le Pleiadi fossero realmente legate gravitazionalmente e che avessero un'origine comune. https://it.wikipedia.org/wiki/Pleiadi_(astronomia)"
M46,NGC 2437,Ammasso aperto,Poppa,"A.R. 07h 41,8min; Dec. −14° 49'",5400 a.l.,"6,1",27',30 a.l.,"M 46 (noto anche come Messier 46 o NGC 2437) è un ammasso aperto visibile nella costellazione della Poppa. Può essere osservato anche con un binocolo.M46 si trova ad una distanza di circa 5.400 anni luce dalla Terra, ed ha un'età stimata a 300 milioni di anni. L'ammasso contiene circa 500 stelle, di cui 150 di magnitudine tra 10 e 13; il suo diametro angolare è di circa 27', mentre il suo diametro reale è di 30 anni luce. Studiando il suo spostamento verso il rosso si deduce che l'ammasso recede rispetto a noi alla velocità di 41,4 km/s. Caratteristica interessante di questo ammasso, come detto prima, è la presenza di una nebulosa planetaria, catalogata come NGC 2438, che sembra trovarsi apparentemente al suo interno. In realtà essa è più vicina M46: la sua distanza è stata stimata in 2.900 anni luce e si trova sovrapposta all'ammasso per un semplice effetto di prospettiva"
M47,NGC 2422,Ammasso aperto,Poppa,"A.R. 07h 36,6min; Dec. −14° 30’",1600 a.l.,"4,4",30',14 a.l.,"M 47 (noto anche come Messier 47 o NGC 2422) è un ammasso aperto visibile nella costellazione della Poppa. Può essere osservato anche con un binocolo. M47 si trova ad una distanza di 1.600 anni luce dalla Terra ed ha un'età stimata intorno ai 78 milioni di anni. È quindi un ammasso abbastanza giovane, e la sua popolazione stellare è simile a quella delle Pleiadi. Circa 50 stelle si trovano all'interno di questo ammasso, la più brillante è una gigante di tipo B2 di magnitudine 5,7. Nel gruppo si conoscono due stelle arancioni, di magnitudine 7,83 e 7,93 che, se sono membri effettivi dell'ammasso, devono essere 200 volte più luminose del Sole. La densità media dell'ammasso è di 0,62 stelle per parsec cubo, ma nelle regioni centrali questa sale fino a 16. M47 si allontana da noi alla velocità di circa 9,7 km/s."
M48,NGC 2548,Ammasso aperto,Idra,"A.R. 08h 13,8min; Dec. −05° 48’",1500 a.l.,"5,8",54',23 a.l.,"M 48 (conosciuto anche come Messier 48 o NGC 2548) è un ammasso aperto visibile nella parte più orientale nella vasta costellazione dell'Idra, sul confine convenzionale col l'Unicorno. Di facile osservazione, anche con un semplice binocolo, appare ben visibile con facilità da entrambi gli emisferi.Questo ammasso si trova a circa 1500 anni luce dal sistema solare e dovrebbe contenere all'incirca 80 stelle fino alla magnitudine 13, di cui una cinquantina sono visibili anche con un binocolo o un piccolo telescopio. La regione più densa del nucleo si estende per oltre 30 minuti d'arco, mentre le regioni esterne si estendono fino a 54'. L'ammasso possiede un diametro di circa 23 anni luce. La stella più calda di M48 è di tipo spettrale A2, con magnitudine di 8,8; l'ammasso inoltre contiene tre giganti gialle di tipo spettrale G e K. Ha un'età stimata intorno ai 300 milioni di anni, un valore medio per questo tipo di oggetti; la sua distanza è invece stimata sul 1500 anni luce ed è dunque appartenente al nostro stesso braccio di spirale galattico, il Braccio di Orione."
M49,NGC 4472,Tipo di oggetto: galassia ellittica (tipo E4),Vergine,"A.R. 12h 29,8min ; Dec. +08° 00'",55.000.000 a.l.,"8,6",9',150.000 a.l.,"M 49 (conosciuta anche con il nome di NGC 4472) è una galassia ellittica distante circa 55 milioni di anni luce; fu scoperta da Charles Messier nel 1771 e fa parte dell'Ammasso della Vergine. M49 ha due probabili galassie satelliti, catalogate come NGC 4465 e NGC 4467.M49 è una galassia ellittica, classificata secondo la sequenza di Hubble come E2 o E4; è una delle galassie più luminosa dell'Ammasso della Vergine. a cui appartiene, sebbene si trovi in una posizione leggermente decentrata rispetto al nucleo centrale dell'ammasso. La sua magnitudine assoluta è pari a -22,7 e la sua classe spettrale integrata è di tipo G7, dunque dal marcato colore giallo, più delle altre galassie della zona. Secondo alcune stime, M49 avrebbe un numero di ammassi globulari compreso fra 5000 e 7000, decine di volte superiore a quello della nostra Via Lattea; le sue dimensioni reali sarebbero comprese fra 140000 e 160000 anni luce, che alla distanza di 55 milioni di anni luce equivalgono ad un diametro apparente di 9'. Tutt'attorno sono presenti un gran numero di galassie compagne. Nel 1969 è stata scoperta una supernova, non confermata, catalogata come SN 1969Q; la stella di tredicesima magnitudine visibile sull'alone di M49 talvolta viene scambiata per una supernova, ma in realtà è una stella appartenente alla nostra Galassia"
M50,NGC 2323,Ammasso aperto,Unicorno,"A.R. 07h 03,2min; Dec. −08° 20'",3000 a.l.,"5,9",15' x 20',18 a.l.,"M 50 (conosciuto anche come Messier 50 o NGC 2323) è un ammasso aperto visibile nella costellazione dell'Unicorno. Fa parte del Catalogo di Messier, sebbene non sia comunque l'oggetto più luminoso della costellazione; in un cielo in condizioni perfette è al limite della visibilità ad occhio nudo.M50 si trova ad una distanza di circa 3000 anni luce dal Sole (le stime però non sono ancora precise). Ha un diametro angolare di 15x20, e quindi dovrebbe avere una dimensione lineare di circa 18 anni luce, ma la regione centrale ne misura solo 9. Si stima che M50 possieda all'incirca 200 componenti. La stella più luminosa è di tipo spettrale B8 o B6 a seconda delle fonti. Una bella caratteristica di questo ammasso è che a 7' a sud del centro si trova una gigante rossa di tipo M, che con il suo colore contrasta con le stelle bianche e azzurre nelle vicinanze. L'ammasso contiene anche alcune giganti gialle.Ha un'età stimata in 78 milioni di anni."
M51,Galassia Vortice NGC 5194 - NGC 5195,Galassia a spirale e galassia peculiare,Cani da caccia,"A.R. 13h 29,9min; Dec. +47° 12'",31.000.000 a.l.,9,11' x 8',100.000 a.l.,"M 51 è un oggetto astronomico del catalogo di Messier che comprende due galassie distinte, nella costellazione boreale dei Cani da Caccia: la più grande e famosa Galassia Vortice (anche nota come NGC 5194 e talvolta M51A) è una classica galassia a spirale. Fu scoperta da Charles Messier il 13 ottobre del 1773. La più piccola galassia compagna nota come NGC 5195 (o anche M51B), è parzialmente coperta da un braccio di polvere della spirale Vortice (con la quale interagisce) ed è stata scoperta da Pierre Méchain nel 1781.La Galassia Vortice è una delle più luminose e interessanti galassie nel cielo: dista dalla Terra da 15 a 37 milioni di anni luce ed è ampia da 50.000 a 100.000 anni luce. È anche il membro dominante di un piccolo gruppo di galassie, chiamato gruppo di M51. Buona parte della sua intensa luminosità è dovuta alla presenza, nei bracci, di giovani ammassi stellari. Questa galassia fu la prima di cui si osservò la struttura a spirale, ad opera di William Parsons nel 1845; gli astronomi ipotizzano che la forma a spirale sia dovuta principalmente alle interazioni gravitazionali con la galassia più piccola. La spirale disegnata dai bracci della galassia è una spirale logaritmica.La Galassia Vortice è unita a NGC 5195 attraverso un involucro comune di gas. L'interazione fra le due galassie ha comportato un incremento della creazione di stelle in NGC 5195. Anche il nucleo della Galassia Vortice è più luminoso di quanto ci si potrebbe aspettare, e questo ha portato alcuni studiosi a classificarla come una galassia di Seyfert attiva. https://it.wikipedia.org/wiki/M51_(astronomia)"
M52,"NGC 7654","Ammasso
aperto",Cassiopea,"A.R. 23h 24,2min ; Dec. +61°
35",4500 a.l.,"7,3",13',19 a.l.,"M 52 (conosciuto anche come NGC 7654) è un ammasso aperto visibile nella costellazione di Cassiopea. M52 è un ammasso estremamente ricco e compatto, con una densità media stimata di circa 3 stelle per parsec cubico, e addirittura fino a 50 stelle per parsec cubico nella zona centrale. Il suo diametro apparente è pari a 13 minuti d'arco, e un diametro reale di circa 19 anni luce. Non si conosce la distanza esatta di questo ammasso dal nostro sistema solare: le stime vanno dai 3900 ai 4900 anni luce, ma viene accettato un valore sui 4500 anni luce (1380 parsec); queste differenze sono dovute principalmente al forte assorbimento interstellare che la sua luce incontra nella nostra direzione, che complica notevolmente il raggiungimento di una stima precisa. L'età media stimata di M52 è di circa 160 milioni di anni, anche se le diverse stime riportano età comprese fra i 25 e i 158 milioni di anni; si tratta comunque di un ammasso relativamente giovane, che contiene diverse stelle di classe spettrale B, ossia stelle azzurre e massicce. La componente più luminosa sulla sequenza principale è di magnitudine 11 e di tipo spettrale B7. L'ammasso contiene anche cinque variabili pulsanti a lungo periodo di classe B (SPB) e una stella particolare di tipo Of: una stella estremamente calda con peculiari linee spettrali di elio ed azoto ionizzati.[ Nelle regioni interne dell'ammasso vi è una marcata assenza di materia interstellare, la quale è stata probabilmente espulsa dall'azione del vento stellare delle componenti maggiori oppure dall'esplosione di una o più supernovae in epoche passate; le regioni centrali di M52 appaiono anche prive di stelle particolarmente luminose e massicce, a differenza di come avviene in altri ammassi in cui è più evidente l'effetto della segregazione di massa."
M53,NGC 5024,Ammasso globulare,Chioma di Berenice,"A.R. 13h 12,9min; Dec. +18°
10'",60.000 a.l.,"7,6",10',150 a.l.,"M 53 (conosciuto anche come NGC 5024) è un ammasso globulare visibile nella costellazione della Chioma di Berenice. M53 è uno degli ammassi globulari più lontani da noi, infatti si trova a circa 58.000 anni luce dal Sistema Solare e a 60.000 anni luce dal centro galattico; il suo diametro angolare, di poco più di 10', corrisponde ad un'estensione lineare di circa 150 anni luce. Quest'ammasso contiene circa una cinquantina (47 accertate) di variabili, in maggioranza del tipo RR Lyrae; il suo moto proprio è di circa 80 km/s in avvicinamento."
M54,NGC 6715,Ammasso globulare,Sagittario,"A.R. 18h 55,1min; Dec. −30°
29'",87.000 a.l.,"7,7","9,1'",150-200 .l.,"M 54 (conosciuto anche come NGC 6715) è un ammasso globulare visibile nella costellazione del Sagittario. Per molto tempo si è ritenuto che M54 si trovasse a circa 50.000 anni luce dalla Terra, ma nel 1994 si è scoperto che M54 non appartiene alla Via Lattea, ma più probabilmente alla Galassia Nana Ellittica del Sagittario, in inglese Sagittarius Dwarf Elliptical Galaxy (sagDEG). In base ai nuovi dati, M54 è quindi diventato il primo ammasso globulare extragalattico mai scoperto. Le stime moderne pongono M54 a circa 87.000 anni luce e si ritiene abbia un raggio di 150-200 anni luce. A tale distanza M54 sarebbe uno degli ammassi globulari più luminosi che si conoscano, superato nella nostra galassia solo da Omega Centauri.M54 ha almeno 82 variabili note, la maggioranza delle quali appartiene al tipo RR Lyrae, ma vi sono anche due variabili rosse semiregolari con periodi di 77 e 101 giorni. È uno degli ammassi globulari più densi, appartenente alla classe III (alla classe I appartengono gli ammassi più densi, alla classe XII quelli meno densi). Recede da noi alla velocità di 130 km/s."
M55,NGC 6089,Ammasso globulare,Sagittario,"A.R. 19h 40,0min ; Dec. −30° 58'",17.300 a.l.,"6,3",19',110 a.l.,"M 55 (conosciuto anche come NGC 6809) è un ammasso globulare visibile nella costellazione del Sagittario. M55 si trova ad una distanza di circa 17.300 anni luce dalla Terra. In questo ammasso sono state scoperte solo una mezza dozzina di stelle variabili. La sua estensione lineare è valutata in circa 110 anni luce. M55 viene considerato uno degli ammassi globulari più vicini a noi, al contrario di M54, che si trova a poco più di 7° ad ovest, e che è invece tra i più lontani."
M56,NGC 6679,Ammasso globulare,Lira,"A.R. 19h 16,6min; Dec. +30° 11'",32.900 a.l.,"8,3",7',84 a.l.,"M 56 (conosciuto anche come NGC 6779) è un ammasso globulare visibile nella costellazione della Lira. M56 si trova ad una distanza di circa 32.900 anni luce dalla Terra e il suo diametro misura approssimativamente 84 anni luce; è uno degli ammassi globulari meno brillanti, soprattutto perché manca del nucleo molto brillante di cui è dotato la maggior parte di questi tipi di ammasso. Ciononostante, non è difficile da risolvere in stelle, anche se si trova ad una notevole distanza. Le stelle più brillanti in M56 sono di magnitudine 13 e in esso sono state trovate solo una dozzina di stelle variabili. M56 si dirige verso noi alla velocità di 138 km/s."
M57,Nebulosa ad Anello o Nebulosa anulare della Lira NGC 6720,Nebulosa planetaria,Lira,"A.R. 18h 53,6min; Dec. +33° 02'",2.300 a.l.,"9,7","230"" x 230""","2,6 a.l.  ","La Nebulosa Anello (nota anche come M 57 o NGC 6720) è una nebulosa planetaria visibile nella costellazione boreale della Lira; dista circa 2000 anni luce dalla Terra e ha un diametro di circa due anni luce. È una delle nebulose più famose. La forma ad anello è in realtà un effetto prospettico poiché dalla Terra possiamo osservarla da uno dei poli. Se potessimo osservarla dal piano equatoriale avrebbe l'aspetto della Nebulosa Manubrio (M27). M57 è un esempio di quella classe di nebulose planetarie note come nebulose bipolari, caratterizzate da una simmetria assiale bilobata, mostrando così una struttura ad anello se osservata lungo il suo asse maggiore di simmetria. Appare essere uno sferoide molto allungato con forti concentrazioni di materiale lungo l'equatore; dalla Terra l'asse di simmetria si osserva a circa 30°. Si stima che la nebulosità osservata si stia espandendo da circa 1.610 ± 240 anni."
M58,NGC 4579,Galassia a spirale barrata (tipo SBc),Vergine,"A.R. 12h 37,7min; Dec. +11° 49'",64.000.000 a.l.,"9,7",6',107.000 a.l.,"M 58 (nota anche come NGC 4579) è una galassia a spirale barrata distante 64 milioni di anni luce dalla terra, visibile nella costellazione della Vergine; fu scoperta da Charles Messier nel 1779 e appartiene all'Ammasso della Vergine. La massa di M58 è stata stimata in 300 miliardi di masse solari, dunque comparabile con quella della nostra Via Lattea; il suo diametro sarebbe di 107.000 anni luce. La sua magnitudine assoluta è -21,1, e la sua magnitudine apparente è pari a +9,7. M58 appare allontanarsi alla velocità di 1.517 km/s, con una distanza stimata in 64 milioni di anni luce: dunque paragonabile con quella delle galassie dell'Ammasso della Vergine di cui è parte. In questa galassia sono state osservate due supernove: la SN 1998A, di tipo II, che toccò magnitudine 13,5, e la SN 1989M, di tipo Ia, che raggiunse la magnitudine 12,2."
M59,NGC 4621,Galassia ellittica (tipo E5),Vergine,"A.R. 12h 42,0min; Dec. +11° 39'",60.000.000 a.l.,"10,6",5',90.000 a.l.,"M 59 (conosciuta anche con il nome di NGC 4621) è una galassia ellittica di tipo E5 appartenente all'Ammasso di galassie della Vergine; dista circa 60 milioni di anni luce dalla Terra. La sua magnitudine visuale è 10,6. M59 è una galassia che appartiene all'Ammasso della Vergine ed è una delle sue galassie ellittiche più grandi, anche se meno luminosa e massiccia di M49, M60 e della gigante M87. La forma di M59 è fortemente schiacciata, tanto da essere classificata come una galassia ellittica di tipo E5. L'asse maggiore ha una dimensione apparente di circa 5 primi d'arco che, considerando una distanza di 60 milioni di anni luce, corrispondono a circa 90 000 anni luce di diametro."
M60,NGC 4649,Galassia ellittica (tipo E2),Vergine,"A.R. 12h 43,7min; Dec. +11° 33'",60.000.000 a.l.,"8,9",7' x 6',120.000 a.l.,"M 60 (conosciuta anche con il nome di NGC 4649) è una galassia ellittica distante circa 60 milioni di anni luce dalla Terra visibile nella costellazione della Vergine. M60 è la terza galassia più brillante dell'ammasso della Vergine, ed è la maggiore del suo sottoammasso, che conta quattro galassie. la sua massa viene stimata in circa mille miliardi di masse solari, dunque diverse volte superiore a quella della nostra Via Lattea; il suo diametro sarebbe invece di 120000 anni luce, anche se l'alone esterno potrebbe essere anche più ampio. La sua magnitudine assoluta è pari a -22,3 e possiede un vasto sistema di ammassi globulari. M60 sembra in pieno processo di interazione con un'altra galassia vicina, la spirale di tipo Sc catalogata come NGC 4647; tuttavia, sebbene la sovrapposizione dei loro aloni suggerisca che queste due galassie siano in processo di interazione, le immagini fotografiche non evidenziano alcuna evidenza di deformazione, come sarebbe normale in caso di galassie realmente così vicine fra loro. Ciò suggerisce che in realtà queste due galassie si trovino sovrapposte solo per un effetto di prospettiva, e potrebbero trovarsi a distanza leggermente maggiori di come possa sembrare. Nel corso del 2004 nella galassia M60 è stata osservata una supernova, catalogata come SN 2004W."
M61,NGC 4303,Galassia a spirale (Tipo SBbc),Vergine,"A.R. 12h 21,9min; Dec. +04° 28'",60.000.000 a.l.,"9,7","6,5'",100.000 a.l.,"M 61 (conosciuta anche con il nome di NGC 4303) è una grande galassia a spirale intermedia situata nell'Ammasso della Vergine e visibile nell'omonima costellazione. Fu scoperta da Barnaba Oriani il 5 maggio del 1779. M61 si trova a 60 milioni di anni luce e con il suo diametro di circa 100.000 anni luce (simile a quello della Via Lattea) è uno dei più grandi membri dell'ammasso della Vergine. Particolarità di questa galassia è la struttura dei suoi bracci: essi mostrano diversi improvvisi cambi di direzione, dei veri e propri angoli che danno ad M61 un aspetto quasi poligonale. La sua massa è stata stimata in 50 miliardi di masse solari almeno e la sua magnitudine assoluta, rapportandola a quella apparente di 9,7, sarebbe pari a -21,2. Il moto proprio della galassia tende a farla allontanare da noi alla velocità di 1464 km/s, similmente a tutto l'Ammasso della Vergine, a cui appartiene. In questa galassia sono state osservate 8 supernove: SN 1926A, SN 1961I, SN 1964F, SN 1999gn, SN 2006ov, SN 2008in, SN2014qt e SN2014dt"
M62,NGC 6266,Ammasso globulare,Ofiuco,"A.R. 17h 01,2min; Dec. −30° 07'",22.500 a.l.,"6,5",15',100 a.l.,"M 62 (conosciuto anche come NGC 6266) è un ammasso globulare visibile nella parte meridionale della costellazione dell'Ofiuco. M62 si trova a una distanza di circa 22.500 anni luce dalla Terra e ha un diametro di 100 anni luce; si trova sul confine tra le costellazioni dell'Ofiuco e dello Scorpione, circa 3° a sud dell'ammasso globulare M19. È uno degli ammassi globulari più irregolari, ciò è probabilmente dovuto alla sua vicinanza al centro della Galassia (6.100 anni luce circa), il quale lo deforma grazie alle forze mareali; questa forza induce l'area sud-orientale dell'ammasso ad essere più concentrata rispetto alle altre.Dagli studi condotti a partire dal 1970 si è ricavato che M62 contiene almeno 89 stelle variabili, molte delle quali del tipo RR Lyrae. L'ammasso contiene inoltre un certo numero di sorgenti di raggi X."
M63,Galassia Girasole NGC 5055,Galassia a spirale (tipo Sb),Cani da caccia,"A.R. 13h 15,8min; Dec. +42° 02'",37.000.000 a.l.,"9,3",10' × 6',90.000 a.l.,"La Galassia Girasole (conosciuta anche come M 63 o NGC 5055) è una galassia a spirale visibile nella costellazione boreale dei Cani da Caccia; fu scoperta nel 1779 da Pierre Méchain, collega e amico del Messier e che collaborò alla stesura del celebre catalogo.La galassia Girasole è una spirale del tipo Sb o Sc, che mostra un irregolare disegno a spirale; apparentemente sembra formare un gruppo fisico con la Galassia Girandola, la Galassia Vortice e molte altre galassie minori; potrebbe appartenere al Gruppo di M101 (sottogruppo di M51). Il nome proprio girasole è dovuto al grandissimo numero di segmenti di spirali che circondano il nucleo, ben avvolte attorno ad esso e pervase da un gran numero di nubi di polvere interstellare; la massa totale della galassia sarebbe compresa fra le 80 e le 140 miliardi di masse solari, con un diametro di 90000 anni luce, ossia simile a quello della nostra Via Lattea. La distanza è stimata sui 37 milioni di anni luce e si allontana da noi alla velocità di 580 km/s.Nel maggio del 1971 è stata osservata fra i suoi bracci una supernova di tipo Ia, che raggiunse la magnitudine apparente 11,8."
M64,Galassia Occhio Nero o Galassia occhio del Diavolo NGC 4826,Galassia a spirale (tipo Sb),Chioma di Berenice,"A.R. 12h 56,7min; Dec. +21° 41'",24.000.000 a.l.,"9,4",10′.0 × 5′.4,35.000 a.l.,"La Galassia Occhio Nero (anche nota come Galassia occhio del Diavolo, M 64 o NGC 4826), è molto ben conosciuta tra gli astronomi amatoriali poiché è ben visibile anche con piccoli telescopi; è una galassia a spirale, dalla forma a girandola, visibile nella costellazione della Chioma di Berenice.Di fronte al luminoso centro galattico c'è una vistosa banda scura di polvere che assorbe la luce, da cui deriva il soprannome ""Occhio nero"".A prima vista M64 sembra assomigliare alle normali galassie girandola a spirale, oscurata in più punti da fitte nebulose oscure; tuttavia, recenti analisi dettagliate hanno portato alla scoperta che i gas interstellari delle regioni esterne ruotano in direzione contraria rispetto ai gas e le stelle nelle regioni interne.Alcuni astronomi ritengono che la rotazione contraria avrebbe avuto inizio quando M64 assorbì una propria galassia satellite, che sarebbe entrata in collisione con essa probabilmente più di un miliardo di anni fa. Nelle regioni di contatto tra le opposte rotazioni, i gas collisero, si compressero contraendosi, dando vita pertanto a una zona di formazione stellare molto attiva. Della piccola galassia che avrebbe impattato con M64 ora non resta quasi più nulla; le sue stelle o sono state assimilate dalla galassia principale o sono state disperse nello spazio come stelle iperveloci, ma i segni della collisione sarebbero visibili nel moto contrario dei gas nelle regioni esterne di M64.Nell'immagine sono di particolare interesse le calde e giovani stelle blu appena formatesi, insieme alle nubi rosa di idrogeno incandescente, che diventa fluorescente quando colpito dai raggi ultravioletti delle stelle appena formate. La distanza di M64 è stimata essere di circa 17 milioni di anni luce dalla Terra (5.2 megaparsec), dunque molto in primo piano rispetto alla gran parte delle galassie osservabili in questa regione di cielo, in particolare quelle più a sud, del grande Ammasso della Vergine; nelle sue spire non sono mai state osservate supernovae. La sua distanza da noi aumenta di 377 km/s."
M65,NGC 3623,Galassia spirale (tipo Sa),Leone,"A.R. 11h 18,9min; Dec. +13° 05'",22.000.000 a.l.,"9,3",10' x 3',70.000 a.l.,"M 65 (conosciuto anche come NGC 3623) è una galassia a spirale visibile nella costellazione del Leone. È stata scoperta da Pierre Méchain nel 1780. M65 forma un tripletto di galassie ben visibile, il Tripletto del Leone, assieme alle sue vicine: la galassia spirale M66 e la galassia spirale NGC 3628.La galassia dista 22 milioni di anni luce da noi; la sua magnitudine apparente è 9,3 ed è quindi meno luminosa della sua compagna M66. La sua morfologia secondo la sequenza di Hubble è Sa, dunque una galassia spirale, sebbene sia vista da un'angolazione molto inclinata, per cui la si può osservare quasi di taglio; i bracci di spirale sono attraversati da un sistema di polveri oscure, in cui nelle immagini ad alta risoluzione sono evidenti stelle azzurre molto luminose, segno che è in atto la formazione stellare. Il suo diametro reale sarebbe di 70000 anni luce e la sua massa pari a 85 miliardi di masse solari."
