Numero catalogo,Nome,Tipo di oggetto,Costellazione,Coordinate (2000),Distanza,Magnitudine visuale,Dimensioni apparenti,Dimensioni reali,Descrizione
M88,NGC 4501,Galassia spirale (Tipo Sc),Chioma di Berenice,"A.R. 12h 32,0min; Dec. +14° 25'",50.000.000 a.l.,"10,4",6′.9 × 3′.7,130.000 a.l.,"M 88 (nota anche come NGC 4501) è una galassia a spirale visibile nella costellazione della Chioma di Berenice; fu scoperta da Charles Messier nel 1781. Fa parte dell'Ammasso della Vergine. M88 appartiene all'Ammasso della Vergine; la sua inclinazione rispetto alla nostra linea di vista è di circa 30°, sufficiente perché siano visibili le strutture dei bracci di spirale, che appaiono ben marcati; le sue dimensioni sono pari a 130.000 anni luce, dunque superiori a quelle della Via Lattea, così come la sua massa, stimata in circa 200 miliardi di masse solari. La distanza sarebbe di circa 50 milioni di anni luce. Secondo le stime sulla sua velocità radiale la galassia retrocede da noi alla velocità di 2.285 km/s; nel maggio del 1999 è stata osservata una supernova classificata come SN 1999cl, che raggiunse una magnitudine apparente pari a 13,6"
M89,NGC 4552,Galassia ellittica (tipo E0),Vergine,"A.R. 12h 35,7min; Dec. +12° 33'",50.000.000 a.l.,"10,7",5′.1 × 4′.7,65.000 a.l.,"M 89 (anche chiamata NGC 4552) è una galassia ellittica visibile nella costellazione della Vergine; fu scoperta da Charles Messier il 18 marzo 1781. M89 fa parte dell'Ammasso della Vergine. Osservazioni condotte negli anni novanta mostrano come M89 sia quasi perfettamente sferica nella sua forma: ciò non è usuale per le galassie ellittiche, che sono tutte ellissoidi allungati; è possibile che la galassia sia orientata in modo da apparire sferica ad un osservatore sulla Terra ma sia in realtà ellittica. La galassia inoltre è circondata da una struttura formata da gas o polveri che si estende fino a 150.000 anni luce dalla galassia. Sono anche presenti getti di particelle che arrivano fino ad una distanza di 100.000 anni luce, segno che la galassia poteva essere in origine un quasar o una radiogalassia. M89 contiene inoltre un'estesa popolazione di ammassi globulari, se comparata con la Via Lattea: infatti, mentre la nostra Galassia ne possiede circa 150-200, M89 ne avrebbe, secondo uno studio condotto nel 2006, circa 2000 ± 700, compresi entro 10' dal suo nucleo."
M90,NGC 4569,Galassia a spirale (tipo Sb),Vergine,"A.R. 12h 36,8min; Dec. +13° 10'",60.000.000 a.l.,"9,3","9,5'x4,5'",150.000 a.l.,"M 90 (nota anche come NGC 4569) è una galassia a spirale visibile nella costellazione della Vergine; è una delle otto galassie trovate e catalogate da Charles Messier il 18 marzo 1781 nella regione Chioma-Vergine, assieme all'ammasso globulare M92 dell'Ercole. M90 è una delle galassie a spirale più grandi (9,5x4,5') dell'Ammasso della Vergine. Ha bracci a spirale, molto stretti e uniformemente brillanti, che sembrano completamente ""fossilizzati"", nel senso che non sembra esserci formazione di stelle in corso, con la sola eccezione della regione interna del disco, vicino ad alcune linee scure di polvere. Probabilmente il suo mezzo interstellare è stato in gran parte strappato via dalle intense forze mareali presenti all'interno dell'ammasso in cui si trova; altre teoria affermano che sia stato spazzato via da esplosioni multiple di supernovae avvenute nella regione del nucleo, dove la formazione stellare è ancora attiva. La sua distanza è approssimativamente 60 milioni di anni luce ed ha una magnitudine apparente di 9,3. Dal momento che si avvicina a noi a una velocità di 383 km/s, si deve muovere a una velocità particolarmente elevata, vicina a 1.500 km/s, attraverso l'Ammasso della Vergine nella nostra direzione, ed è possibile che sia sul punto di fuggire dall'ammasso; secondo alcune fonti avrebbe già lasciato l'ammasso e adesso sarebbe molto più vicina a noi. Solo un'altra galassia di Messier, M86, ha una velocità di avvicinamento più rapida."
M91,NGC 4548,Galassia spirale barrata (tipo SBb),Chioma di Berenice,"A.R. 12h 35,4min; Dec. +14° 30'",63.000.000 a.l.,11,"5,4' × 4,4'",80.000 a.l.,"M 91 (nota anche come NGC 4548) è una galassia a spirale barrata visibile nella costellazione della Chioma di Berenice; fu scoperta da Charles Messier nel 1781 e poi riscoperta da William Herschel tre anni dopo. Fa parte dell'Ammasso della Vergine.M91 possiede un diametro pari a circa 80.000 anni luce, dunque sarebbe più piccola della nostra Via Lattea; anche la sua massa, pari a 90 miliardi di masse solari, è inferiore. La classificazione secondo la sequenza di Hubble è SBb, ossia una galassia spirale barrata di tipo intermedio; la sua distanza è stimata sui 63 milioni di anni luce. La sua velocità radiale è di 400 km/s in recessione: ciò vuol dire che, rispetto all'ammasso della Vergine, M91 ha un considerevole moto di avvicinamento rispetto a noi (700 km/s). La velocità di recessione rispetto a noi dell'ammasso della Vergine, infatti, è di circa 1100 km/s. Nei suoi bracci di spirale non sono mai state osservate supernovae."
M92,NGC 6341,Ammasso globulare,Ercole,"A.R. 17h 17,1min; Dec. +43° 08'",26.000 a.l.,"6,3","11,2'",84 a.l.,"M 92 (noto anche come NGC 6341) è un ammasso globulare visibile nella costellazione di Ercole; è fra gli ammassi globulari più settentrionali del cielo.M92 si trova a 26.000 anni luce dal sistema solare ed è quindi un po' più lontano del suo vicino M13. La concentrazione di stelle al centro dell'ammasso è notevole e la sua estensione angolare di 11.2' corrisponde ad un diametro effettivo di 85 anni luce. Al suo interno sono state scoperte soltanto 16 variabili, 14 delle quali sono del tipo RR Lyrae. La massa di M92 è di circa 300.000 masse solari, quindi abbastanza elevata.; si avvicina a noi a una velocità di 110 km/s. La percentuale di metalli molto scarsa nella composizione delle stelle dell'ammasso suggerisce un'età elevata per l'ammasso. Le stime basate sul colore delle stelle indicano un'età di 13 miliardi di anni; è quindi uno dei più antichi ammassi globulari conosciuti."
M93,NGC 2447,Ammasso aperto,Poppa,"A.R. 07h 44,6min; Dec. −23° 52'",3600 a.l.,6,22',22 a.l.,"M 93 (conosciuto anche come Messier 93 o NGC 2447) è un ammasso aperto visibile nella costellazione della Poppa. È uno degli oggetti più meridionali catalogati dal Messier ed è di facile osservazione. M93 è a una distanza di circa 3.600 anni luce dalla Terra, dunque sul bordo esterno del nostro braccio di spirale, il Braccio di Orione, mentre il suo raggio è stimato essere compreso tra 10 e 12 anni luce (dunque un diametro di circa 22 anni luce); la sua età è stimata in circa 100 milioni di anni. Le stelle più brillanti di M93 sono giganti blu del tipo B9, di magnitudine apparente 8,20. L'indice di colore B-V dell'ammasso è di 0,37, con un assorbimento di quasi 0,2 magnitudini, dovuto principalmente all'assorbimento da parte della polvere interstellare."
M94,NGC 4736,Galassia spirale (tipo Sab),Cani da caccia,"A.R. 12h 50,9min; Dec. +41° 07'",16.000.000 a.l.,9,11′.2 × 9′.1,45.000 a.l.,"M 94 (conosciuto anche come NGC 4736) è una galassia a spirale visibile nella costellazione dei Cani da Caccia; fu scoperta da Pierre Méchain nel 1781 e catalogata da Charles Messier due giorni dopo. Dalle osservazioni si può notare un anello di attive regioni di formazione stellare, marcate dalle giovani stelle azzurre nelle immagini a colori, che la dividono bruscamente dal molto meno brillante anello esterno, il quale è formato da una popolazione stellare giallastra molto più vecchia; nelle aree periferiche, tuttavia, queste regioni terminano nuovamente in un altro anello di moderata attività di formazione stellare, così M94 appare come una delle relativamente rare galassie in cui possono essere osservate due ""onde"" di formazione stellare. Nelle lunghissime esposizioni diviene visibile un ulteriore debolissimo anello. La galassia è classificata come spirale semplice (Sab) ed è vista quasi perfettamente di faccia; la sua distanza non è ben nota, dato che esistono valori compresi fra i 14 e i 30 milioni di anni luce. Le ultime stime forniscono un valore di 16 milioni di anni luce. M94 si allontana da noi alla velocità di 370 km/s. "
M95,NGC 3351,Galassia spirale barrata (tipo SBb),Leone,"A.R. 10h 44,0min; Dec. +11° 42'",32.600.000 a.l.,"9,7","7′,4 × 5′,1",55.000 a.l.,"M 95 (conosciuta anche come NGC 3351) è una galassia a spirale barrata visibile nella costellazione del Leone; fa parte di un gruppo di galassie situate proprio al centro della costellazione del Leone, detto Leo I. Fu scoperta, insieme a M96, da Pierre Méchain, il 20 marzo 1781. M95 è una delle galassie più studiate dal telescopio spaziale Hubble al fine di determinare la costante di Hubble, studiandone le variabili Cefeidi allo scopo di determinarne la distanza; i risultati, che furono poi corretti tramite l'ausilio del telescopio Hipparcos, indicano una distanza di 32,6 milioni di anni luce con uno scarto di 1,4 milioni di anni luce. Questa galassia mostra una notevole attività nelle sue regioni centrali, in particolare in un anello del diametro di circa 600 parsec attorno al centro, composto probabilmente di gas diffuso non uniforme. Le emissioni di raggi X provengono da numerose fonti, che sono concentrate in regioni di gas caldo, la morfologia dell'emissione può spiegarsi se si sta presentando una serie di starbursts istantanei situati in diverse zone dell'anello. L'estensione dei raggi X va almeno 500 parsec oltre l'anello, che può essere interpretato come un'uscita di gas al di là dello stesso. Ha una velocità di allontanamento (redshift) di 600 km/s."
M96,NGC 3368,Galassia spirale (tipo Sa),Leone,"A.R. 10h 46,8min; Dec. +11° 49'",31.300.000 a.l.,"9,24","7′,6 × 5′,2",65.000 a.l.,"M 96 (conosciuta anche come NGC 3368) è una galassia a spirale intermedia visibile nella costellazione del Leone; fa parte di un gruppo di galassie situate proprio al centro della costellazione del Leone, detto Leo I. Fu scoperta, insieme a M95, da Pierre Méchain, il 20 marzo 1781. M96 è una galassia spirale posta alla distanza di 31,3 milioni di anni luce; a questa distanza, le sue regioni centrali più luminose possiedono una dimensione reale di oltre 65000 anni luce, le quali però sono circondate da una struttura ad anello relativamente debole, esteso per oltre 100000 anni luce: questa struttura possiede un gran numero di stelle giovani e blu molto luminose, che le conferiscono il caratteristico colore azzurrino. Questa regione è sede di importanti fenomeni di formazione stellare; le regioni centrali sono invece composte da stelle più vecchie e il colore dominante è il giallo. La massa della galassia è stata stimata essere di 160 miliardi di masse solari; l'inclinazione sulla nostra linea di vista del suo piano galattico è di 35°. Nel 1998 è stata osservata una supernova che raggiunse la magnitudine apparente 11,8."
M97,Nebulosa Gufo Nebulosa Civetta NGC 3587,Nebulosa planetaria,Orsa Maggiore,"A.R. 11h 14,8min; Dec. +55° 01'",2.600 a.l.,"9,9","3,4' x 3,3'",3 a.l.,"La nebulosa Civetta (nota anche come Nebulosa Gufo o con le sigle M 97 o NGC 3587) è una nebulosa planetaria visibile nella costellazione dell'Orsa Maggiore; è stata scoperta da Pierre Méchain nel 1781. Il nome ""Nebulosa Gufo"" è stato invece assegnato da William Parsons nel 1848 a causa delle due macchie scure, che assomigliano agli occhi di un gufo. M97 è una delle nebulose planetarie più complesse. Il suo aspetto è stato interpretato come una sfera senza poli, con gli occhi del gufo in corrispondenza delle zone povere di materia ai poli. La sua età è stimata in 6.000 anni. M97 è una delle più grandi nebulose planetarie conosciute, in termini assoluti: si estende per un diametro di quasi 3 anni luce e la sua magnitudine apparente è pari a 9,9; la stella centrale invece è una nana bianca estremamente calda, di quattordicesima magnitudine, la cui temperatura superficiale si aggira sugli 85.000 kelvin e la sua massa sarebbe pari a 0,7 masse solari. La distanza dell'oggetto è stata a lungo oggetto di dibattito: le stime variavano da un minimo di 1600 anni luce fino ad un massimo di ben 12.000, il che l'avrebbe posta ben oltre il bordo del piano galattico; oggi si tende ad accettare un valore di 2600 anni luce. La massa totale della nebulosa è di 0,15 masse solari e la sua densità è estremamente bassa, circa un decimo di quella media delle altre planetarie; ciò sarebbe indice dell'elevata età della nebulosa, dato che col tempo si è notevolmente espansa e i suoi gas si sono rarefatti. L'età sarebbe dunque sui 6000 anni.Il suo aspetto particolare sarebbe invece dovuto alla sua forma a toro o a cilindro torico, visto da una prospettiva obliqua."
M98,NGC 4192,galassia spirale (tipo Sb),Chioma di Berenice,"A.R. 12h 13,8min; Dec. +14° 54'",55.000.000 a.l.,11,"9′,8 × 2′,8",150.000 a.l.,"M 98 (nota anche come NGC 4192) è una galassia a spirale visibile nella costellazione della Chioma di Berenice; fu scoperta da Pierre Méchain nel 1781. Fa parte dell'Ammasso della Vergine. Questa galassia fu per lungo tempo creduta come non appartenente all'Ammasso della Vergine, a causa della sua velocità radiale, che la indicava in avvicinamento di 125 km/s; tuttavia in uno studio condotto negli anni novanta viene avanzata l'ipotesi che appartenga allo stesso sottogruppo di M99, che appartiene all'Ammasso della Vergine, alla distanza di circa 55 milioni di anni luce. La massa della galassia sarebbe pari a 170 miliardi di masse solari e il suo diametro sarebbe di 150.000 anni luce, dunque la galassia sarebbe più grande della nostra Via Lattea. La sua magnitudine assoluta è pari a -21,7."
M99,NGC 4254,Galassia spirale (tipo Sc),Chioma di Berenice,"A.R. 12h 18,8min; Dec. +14° 25'",55.000.000 a.l.,"10,4","5′,4 × 4′,7",87.000 a.l.,"M 99 (altrimenti conosciuta come NGC 4254) è una galassia a spirale visibile nella costellazione della Chioma di Berenice; dista approssimativamente 60 milioni di anni luce e fa parte dell'Ammasso della Vergine. M99 è una delle galassie più brillanti dell'Ammasso della Vergine; possiede dei bracci ben sviluppati orientati in senso orario, sebbene siano asimmetrici forse a causa di un'interazione con un'altra galassia, forse la vicina M98. Un altro indizio che possa essere stata disturbata deriva dalla sua velocità radiale: infatti la galassia sembra recedere rispetto a noi alla velocità di 2.407 km/s, che equivale ad un movimento di 1.200 km/s rispetto al centro dell'ammasso di cui fa parte, la più alta fra tutte le galassie osservate dal Messier. Il diametro della galassia è di 87.000 anni luce e la sua massa sarebbe pari a circa 130 miliardi di masse solari; nei suoi bracci sono state osservate tre supernovae, catalogate come SN 1967H, che raggiunse la magnitudine 14, SN 1972Q di tipo II, che raggiunse la magnitudine 15,6, e SN 1986I, di tipo Ia, di magnitudine 14."
M100,NGC 4321,Galassia spirale (tipo Sc),Chioma di Berenice,"A.R. 12h 22,9min; Dec. +15° 49'",55.000.000 a.l.,"10,1","7′,4 × 6′,3",120.000 a.l.,"M 100 (nota anche come NGC 4321) è una galassia a spirale che si trova in direzione della costellazione della Chioma di Berenice, alla distanza di 55 milioni di anni luce da noi. M100 ha due grandi bracci costituiti da stelle più brillanti, e molte altre più deboli; in questi bracci sono state osservate ben cinque supernovae. M100 è uno dei membri più importanti dell'ammasso di galassie della Vergine che si estende fino alla costellazione della Chioma di Berenice, della quale fa parte; la massa di M100 è di 160 miliardi di masse solari, mentre la sua magnitudine assoluta è pari a -21.8. Il suo diametro reale è di 120000 anni luce, dunque di poco superiore rispetto a quello della Via Lattea; la galassia si allontana da noi a 720 km/s, M100 ha invece una velocità di recessione di 1500 km/s."
M101,Galassia Girandola NGC 5457,Galassia spirale (tipo Sc),Orsa Maggiore,"A.R. 14h 03,2min; Dec. +54° 21",19.000.000 a.l.,"8,3",28′.8 × 26′.9,170.000 a.l.,"La Galassia Girandola (nota anche come M 101, o NGC 5457) è una galassia a spirale nella costellazione dell'Orsa Maggiore. La galassia fu scoperta nel 1781 da Charles Messier e da Pierre Méchain. William Herschel fu il primo a osservare delle piccole macchie (che in realtà erano dei frammenti dei bracci a spirale) circondare la galassia.M101 è una galassia di notevole estensione se comparata con la Via Lattea; secondo diversi studi la sua massa sarebbe di circa 16 miliardi di masse solari, ma sembrerebbe essere un valore troppo basso, forse dovuto alla bassa luminosità superficiale della galassia; secondo le nuove scoperte, che comprendono l'individuazione di regioni H II e una forte velocità di rotazione, la massa di M101 sarebbe compresa fra 100 e 1000 miliardi di masse solari. Un'altra proprietà particolare di questa galassia è la presenza di vaste e luminosissime regioni H II, che nelle fotografie raggiunge il numero di 3000 unità; queste regioni, in cui ha luogo la formazione stellare, contengono un gran numero di stelle giovani e calde, di colore blu. Da un lato la galassia presenta un'asimmetria; si crede che si sia formata in tempi astronomicamente recenti a causa dell'interazione con un'altra galassia, che ne ha deformato i bracci a causa delle potenti forze mareali. Inoltre, questo incontro ha amplificato le onde di densità del bracci della galassia, che ha causato a sua volta la compressione del mezzo interstellare con conseguente aumento dell'attività di formazione stellare."
M102,Error NGC404 Galaxy Not Found,Sconosciuto,Sconosciuto,Sconosciuto,Sconosciuto,Sconosciuto,Sconosciuto,Sconosciuto,"La galassia M102 (nota anche come Oggetto Messier 102, Messier 102, o M102) è un oggetto Messier dalla natura controversa. Varie ipotesi sostengono che possa essere:
-una riosservazione accidentale della Galassia Girandola (una galassia a spirale nella costellazione dell'Orsa Maggiore);
-la Galassia Fuso, una galassia a spirale lenticolare nella costellazione del Drago, nota anche come ----NGC 5866;
-NGC 5879, una galassia vicina alla galassia Fuso, anche se non è brillante come quest'ultima;
-NGC 5928, una galassia di magnitudine apparente 14, che difficilmente sarebbe stata osservabile da parte dei compilatori del catalogo.
Nella versione più accreditata si ritiene che M102 sia un nuovo oggetto (la galassia Fuso) scoperto da Pierre Méchain, ma che Charles Messier abbia segnato erroneamente la sua posizione, facendola coincidere con quella di M101. Infatti i due oggetti sono separati da circa 5°, e Messier usava carte con griglie spaziate di 5°."
M103,NGC 581 Ammasso Freccia,Ammasso aperto,Cassiopea,"A.R. 01h 33,2min; Dec. +60° 42'",9400 a.l.,"7,4",6',15 a.l.,"M 103 (conosciuto anche come NGC 581 o, talvolta, col soprannome di Ammasso Freccia) è un ammasso aperto visibile nella costellazione di Cassiopea. M103 è uno dei più lontani ammassi aperti elencati nel Catalogo di Messier, trovandosi a circa 2880 parsec (9400 anni luce) dalla Terra, in un angolo remoto del Braccio di Perseo; esso possiede un diametro apparente di 6 minuti d'arco che, tenendo conto della distanza, corrisponde ad un diametro reale di 15 anni luce.Attraverso le misurazioni sul moto proprio sono state individuate 77 componenti fino alla quattordicesima magnitudine facenti sicuramente parte dell'ammasso (con un indice di sicurezza non inferiore all'80%), cui se ne aggiungono 151 la cui probabilità di appartenenza è inferiore; i due membri più brillanti di M103 sono una supergigante di tipo B5Ib ed una gigante di tipo B2III. Fra queste componenti sono note anche alcune stelle variabili, fra le quali due binarie a eclisse, una delle quali con un'oscillazione di oltre una magnitudine, una probabile variabile Gamma Doradus (o forse una variabile pulsante di lungo periodo di classe spettrale B (SPB)), una stella Be e una gigante rossa pulsante.M103 si avvicina al Sole ad una velocità di circa 37 km/s."
M104,Galassia Sombrero NGC 4594,Galassia spirale (tipo Sa),Vergine,"A.R. 12h 40,0min; Dec. −11° 37’",29.500.000 a.l.,"8,98","8,7' x 3,5'","50,000 a.l.","La Galassia Sombrero (conosciuta anche con le sigle M 104 o NGC 4594) è una galassia nella costellazione della Vergine. La sua vista di taglio con la sua banda oscura l'ha resa famosa ed è un oggetto privilegiato nella fotografia astronomica amatoriale. Questa galassia si trova nella costellazione della Vergine, ma la sua distanza è stimata sui circa 29 milioni di anni luce da noi, ed è quindi più vicina dell'Ammasso della Vergine, del quale non è considerata un membro. Ha una magnitudine apparente di 8 (integrata sull'intera superficie), ed ha un tipo Sa oppure Sb. È invisibile ad occhio nudo ma visibile già con piccoli telescopi. Ha un diametro apparente pari a circa un quinto della Luna piena, ma occorrono grandi telescopi oppure fotografie a lunga posta per vedere le parti più deboli. https://it.wikipedia.org/wiki/Galassia_Sombrero"
M105,NGC 3379,Galassia ellittica (tipo E1),Leone,"A.R. 10h 47,8min; Dec. +12° 35'",32.000.000 a.l.,"9,5","5,4' × 4,8'",35.000 a.l.,"M 105 (conosciuta anche come NGC 3379) è una galassia ellittica visibile nella costellazione del Leone; fa parte di un gruppo di galassie situate proprio al centro della costellazione del Leone. Fu scoperta da Pierre Méchain, il 20 marzo 1781. M105 è la più brillante fra le galassie ellittiche presenti nel Gruppo Leo I, in cui è compreso il sottogruppo a cui appartiene; la sua distanza è stimata sui circa 32 milioni di anni luce. Si tratta di un perfetto esempio di galassia ellittica, grazie alla estrema uniformità di struttura e di luminosità che la caratterizza; delle due galassie che l'accompagnano, entrambe ellittiche, NGC 3389 non sembra essere realmente vicina a M105, dato che la sua velocità radiale è di 1138 km/s, contro i 752 km/s accettati per M105. Secondo degli studi effettuati tramite il Telescopio Spaziale Hubble al centro di questa galassia sarebbe presente un buco nero supermassiccio, la cui massa si aggirerebbe sui 50 milioni di masse solari."
M106,NGC 4258,Galassia spirale (tipo Sbp),Cani da caccia,"A.R. 12h 19,0min; Dec. +47° 18'",23.000.000 a.l.,"8,4","18,6' × 7,2'",115.000 a.l.,"M 106 (conosciuta anche come NGC 4258) è una galassia a spirale visibile nella costellazione dei Cani da Caccia; sembra che il suo interno ospiti un buco nero supermassiccio su cui sta collassando l'intera galassia.M106 è un esempio di galassia di Seyfert; la rilevazione di inconsuete emissioni di onde radio e raggi X osservate tramite il radiotelescopio Very Large Baseline Array indica che probabilmente parte della galassia sta precipitando in un buco nero supermassiccio situato nel suo centro: nel nucleo infatti sembra che sia contenuta una massa pari a 36 milioni di masse solari, concentrata in un volume compreso fra 1/24 e 1/12 di anno luce, ossia fra 12.000 a 54.000 UA. La forma di M106 ricorda quella della Galassia di Andromeda (M31), ma con una diversa inclinazione, in modo che siano così visibili perfettamente tutte le strutture delle nubi di polveri sul piano galattico; i bracci di spirale sono ricchi di regioni H II che nelle immagini si mostrano di colore blu e rosso, a seconda se siano associate o meno ad ammassi di stelle particolarmente calde e luminose. Nel 1981 fra i suoi bracci è apparsa una supernova, classificata come SN 1981K, che raggiunse la sedicesima magnitudine apparente; non essendo stato analizzato lo spettro, non si è mai saputo che tipo di supernova fosse. La distanza della galassia è stimata sui 21-25 milioni di anni luce e la sua massa totale è pari a circa 190 miliardi di masse solari; si allontana da noi alla velocità di 537 km/s."
M107,NGC 6171,Ammasso globulare,Ofiuco,"A.R. 16h 32,5min; Dec. −13° 03’",19.000 a.l.,"8,1",10',55 a.l.,"M 107 (conosciuto anche come NGC 6171) è un ammasso globulare visibile nella costellazione dell'Ofiuco. M107 è molto vicino al piano galattico e si trova ad una distanza di circa 20.900 anni luce dalla Terra; possiede un diametro apparente di 3 minuti d'arco, che corrisponde da un'estensione reale di circa 60 anni luce. Stranamente sembra contenere alcune bande oscure, del tutto insolite in un ammasso globulare; si tratta inoltre di uno degli ammassi globulari meno concentrati: è infatti classificato come di classe X su una scala di concentrazione da I a XII. M 107 ha una velocità radiale di circa 147 km/s in avvicinamento e contiene 25 stelle variabili note."
M108,NGC 3556,Galassia spirale (tipo Sc),Orsa Maggiore,"A.R. 11h 11,5min; Dec. +55° 40'",45.000.000 a.l.,"10,1",8' x 2',110.000 a.l.,"M 108 (conosciuto anche come NGC 3556 o anche con il suggestivo nome di Galassia Surfboard ) è una galassia a spirale a circa 45 milioni di anni luce, nella costellazione dell'Orsa Maggiore, scoperta da Pierre Méchain nel 1781. Nel 2005, Scott D. Davis suggerì il nome, Galassia Surfboard, per il fatto che la sua forma ricorda quello di una tavola da surf. M108 è una galassia a spirale vista quasi perfettamente di taglio: la sua inclinazione è pari a 81° rispetto alla nostra linea di vista; i suoi bracci sono fortemente oscurati da grandi complessi di nebulose oscure e polveri interstellari, che rendono invisibile anche in nucleo galattico. Sono note anche alcune regioni H II, in cui hanno sede fenomeni di formazione stellare. La massa totale della galassia sarebbe di soli 14 miliardi di masse solari, ossia circa un ventesimo di quella della nostra Via Lattea. La sua distanza è stata stimata in 45 milioni di anni luce e sembra allontanarsi da noi alla velocità di 772 km/s."
